{
  "$schema": "http://json-schema.org/draft-07/schema#",
  "$id": "https://qre-dashboard.plextech.dev/contracts/runrecord.schema.json",
  "title": "RunRecord",
  "description": "CANONICAL contract schema (v1.0.0) for a saved, immutable run record (Part 2: persistence, history, rerun). A record embeds the frozen RunConfig and RunResult schemas by reference and adds the persistence identity + timestamp. The record is app-controlled, so this schema is strict (additionalProperties: false). NOTE: JSON Schema cannot cross-compare values, so the invariant `id === config.id === result.runId` is enforced by makeRunRecord() and the test suite, not here. Validation requires the runconfig and runresult schemas registered in the SAME Ajv instance, plus ajv-formats (uuid, date-time). Changes only via the contract-change process in docs/engineering-workflow.md.",
  "type": "object",
  "additionalProperties": false,
  "required": ["schemaVersion", "id", "config", "result", "savedAt"],
  "properties": {
    "schemaVersion": {
      "const": "1.0.0",
      "description": "Contract version."
    },
    "id": {
      "type": "string",
      "format": "uuid",
      "description": "The run's UUID; equals config.id and result.runId. The record's stable key."
    },
    "config": {
      "description": "The producing RunConfig, verbatim.",
      "$ref": "https://qre-dashboard.plextech.dev/contracts/runconfig.schema.json"
    },
    "result": {
      "description": "The RunResult, verbatim (including the complete raw blob).",
      "$ref": "https://qre-dashboard.plextech.dev/contracts/runresult.schema.json"
    },
    "savedAt": {
      "type": "string",
      "format": "date-time",
      "description": "ISO 8601 UTC timestamp, stamped when the record was persisted."
    }
  }
}
