{
  "schemaVersion": "1.0.0",
  "id": "22222222-2222-4222-8222-222222222222",
  "config": {
    "schemaVersion": "1.0.0",
    "id": "22222222-2222-4222-8222-222222222222",
    "name": "Shor's Factoring - Litinski19",
    "createdAt": "2026-07-16T10:30:00Z",
    "application": { "type": "benchmark", "benchmarkId": "shors-factoring" },
    "architecture": {
      "type": "gateBased",
      "errorRate": 0.0001,
      "gateTime": 30,
      "measurementTime": 80,
      "twoQubitGateTime": null
    },
    "qecCode": "surface_code",
    "magicStateFactory": "litinski19",
    "traceTransform": { "type": "psspc", "tStatesPerRotation": 15, "ccxMagicStates": true },
    "maxError": 0.001,
    "qreVersion": "qdk-qre-1.29.1"
  },
  "result": {
    "schemaVersion": "1.0.0",
    "runId": "22222222-2222-4222-8222-222222222222",
    "status": "succeeded",
    "error": null,
    "frontier": [
      {
        "physicalQubits": { "value": 2100000, "unit": "qubits", "display": "2,100,000" },
        "runtime": { "value": 86400000000, "unit": "ns", "display": "24 hr" },
        "logicalCycleTime": { "value": 4000, "unit": "ns", "display": "4 us" },
        "factories": { "value": [{ "stateType": "T", "copies": 320 }], "unit": "factories", "display": "320 x T" },
        "totalError": { "value": 0.0008, "unit": "probability", "display": "8.0e-4" },
        "codeDistance": { "value": 23, "unit": "", "display": "23" },
        "additional": {
          "physicalFactoryQubits": { "value": 1280000, "unit": "qubits", "display": "1,280,000" },
          "source": { "value": "qsharp", "unit": "", "display": "Q#" }
        }
      }
    ],
    "raw": { "engine": "mock-fixture", "application": "shors-factoring", "magicStateFactory": "litinski19" },
    "qreVersion": "qdk-qre-1.29.1",
    "startedAt": "2026-07-16T10:30:01Z",
    "completedAt": "2026-07-16T10:30:03Z"
  },
  "savedAt": "2026-07-16T10:30:04Z"
}
