{
  "schemaVersion": "1.0.0",
  "id": "11111111-1111-4111-8111-111111111111",
  "config": {
    "schemaVersion": "1.0.0",
    "id": "11111111-1111-4111-8111-111111111111",
    "name": "Quantum Dynamics - GateBased 1e-4 - Surface - PSSPC",
    "createdAt": "2026-07-16T09:00:00Z",
    "application": { "type": "benchmark", "benchmarkId": "quantum-dynamics" },
    "architecture": {
      "type": "gateBased",
      "errorRate": 0.0001,
      "gateTime": 50,
      "measurementTime": 100,
      "twoQubitGateTime": null
    },
    "qecCode": "surface_code",
    "magicStateFactory": "round_based",
    "traceTransform": { "type": "psspc", "tStatesPerRotation": 20, "ccxMagicStates": false },
    "maxError": 1,
    "qreVersion": "qdk-qre-1.29.1"
  },
  "result": {
    "schemaVersion": "1.0.0",
    "runId": "11111111-1111-4111-8111-111111111111",
    "status": "succeeded",
    "error": null,
    "frontier": [
      {
        "physicalQubits": { "value": 829766, "unit": "qubits", "display": "829,766" },
        "runtime": { "value": 19100000, "unit": "ns", "display": "19.1 ms" },
        "logicalCycleTime": { "value": 5200, "unit": "ns", "display": "5.2 us" },
        "factories": { "value": [{ "stateType": "T", "copies": 216 }], "unit": "factories", "display": "216 x T" },
        "totalError": { "value": 0.00042, "unit": "probability", "display": "4.2e-4" },
        "codeDistance": { "value": 19, "unit": "", "display": "19" },
        "additional": {
          "physicalFactoryQubits": { "value": 610920, "unit": "qubits", "display": "610,920" }
        }
      },
      {
        "physicalQubits": { "value": 652440, "unit": "qubits", "display": "652,440" },
        "runtime": { "value": 31800000, "unit": "ns", "display": "31.8 ms" },
        "logicalCycleTime": { "value": 6800, "unit": "ns", "display": "6.8 us" },
        "factories": { "value": [{ "stateType": "T", "copies": 144 }], "unit": "factories", "display": "144 x T" },
        "totalError": { "value": 0.00031, "unit": "probability", "display": "3.1e-4" },
        "codeDistance": { "value": 21, "unit": "", "display": "21" }
      }
    ],
    "raw": { "engine": "mock-fixture", "application": "quantum-dynamics", "frontierRows": 2 },
    "qreVersion": "qdk-qre-1.29.1",
    "startedAt": "2026-07-16T09:00:01Z",
    "completedAt": "2026-07-16T09:00:04Z"
  },
  "savedAt": "2026-07-16T09:00:05Z"
}
