{
  "schemaVersion": "1.0.0",
  "id": "33333333-3333-4333-8333-333333333333",
  "config": {
    "schemaVersion": "1.0.0",
    "id": "33333333-3333-4333-8333-333333333333",
    "name": "Grover's Search - Lattice Surgery (sparse)",
    "createdAt": "2026-07-15T14:00:00Z",
    "application": { "type": "benchmark", "benchmarkId": "grovers-search" },
    "architecture": {
      "type": "gateBased",
      "errorRate": 0.0005,
      "gateTime": 40,
      "measurementTime": 90,
      "twoQubitGateTime": null
    },
    "qecCode": "surface_code",
    "magicStateFactory": "round_based",
    "traceTransform": { "type": "latticeSurgery", "slowDownFactor": 1.0 },
    "maxError": 1,
    "qreVersion": "qdk-qre-1.28.0"
  },
  "result": {
    "schemaVersion": "1.0.0",
    "runId": "33333333-3333-4333-8333-333333333333",
    "status": "succeeded",
    "error": null,
    "frontier": [
      {
        "physicalQubits": { "value": 12000, "unit": "qubits", "display": "12,000" },
        "runtime": { "value": 0, "unit": "ns", "display": "0 ns" },
        "logicalCycleTime": { "value": 5000, "unit": "ns", "display": "5 us" },
        "factories": { "value": [], "unit": "factories", "display": "none" },
        "totalError": { "value": 0, "unit": "probability", "display": "0" },
        "codeDistance": { "value": 7, "unit": "", "display": "7" }
      }
    ],
    "raw": { "engine": "mock-fixture", "note": "clifford-only sparse run", "factories": 0 },
    "qreVersion": "qdk-qre-1.28.0",
    "startedAt": "2026-07-15T14:00:01Z",
    "completedAt": "2026-07-15T14:00:07Z"
  },
  "savedAt": "2026-07-15T14:00:08Z"
}
