{
  "schemaVersion": "1.0.0",
  "id": "77777777-7777-4777-8777-777777777777",
  "config": {
    "schemaVersion": "1.0.0",
    "id": "77777777-7777-4777-8777-777777777777",
    "name": "Shor's Factoring - Majorana Three-Aux",
    "createdAt": "2026-07-16T14:30:00Z",
    "application": { "type": "benchmark", "benchmarkId": "shors-factoring" },
    "architecture": { "type": "majorana", "errorRate": 0.00001, "operationTime": 1000 },
    "qecCode": "three_aux",
    "magicStateFactory": "round_based",
    "traceTransform": { "type": "psspc", "tStatesPerRotation": 20, "ccxMagicStates": false },
    "maxError": 0.01,
    "qreVersion": "qdk-qre-1.29.1"
  },
  "result": {
    "schemaVersion": "1.0.0",
    "runId": "77777777-7777-4777-8777-777777777777",
    "status": "succeeded",
    "error": null,
    "frontier": [
      {
        "physicalQubits": { "value": 890000, "unit": "qubits", "display": "890,000" },
        "runtime": { "value": 43200000000, "unit": "ns", "display": "43.2 s" },
        "logicalCycleTime": { "value": 2500, "unit": "ns", "display": "2.5 us" },
        "factories": { "value": [{ "stateType": "T", "copies": 96 }], "unit": "factories", "display": "96 x T" },
        "totalError": { "value": 0.006, "unit": "probability", "display": "6.0e-3" },
        "codeDistance": { "value": 17, "unit": "", "display": "17" },
        "additional": {
          "physicalFactoryQubits": { "value": 520000, "unit": "qubits", "display": "520,000" },
          "source": { "value": "qsharp", "unit": "", "display": "Q#" }
        }
      }
    ],
    "raw": { "engine": "mock-fixture", "application": "shors-factoring", "architecture": "majorana" },
    "qreVersion": "qdk-qre-1.29.1",
    "startedAt": "2026-07-16T14:30:01Z",
    "completedAt": "2026-07-16T14:30:02Z"
  },
  "savedAt": "2026-07-16T14:30:04Z"
}
